Kod sklepu;Kod segmentu;Data od;Data do;Nazwa planogramu;Wersja planogramu;Opis planogramu;Numer półki;Pozycja;Index;Nazwa;Liczba twarzy;Sposób ekspozycji
Text;Int;Text;Text;Text;Text;Text;Int;Int;Text;Text;Int;Int
shop_planogram_assignment.shop.codes;shop_planogram_assignment.segment.id;shop_planogram_assignment.start_date_time;shop_planogram_assignment.end_date_time;planogram.name;planogram.version;planogram.description;planogram_element.shelf;planogram_element.position;planogram_element.sku.index;planogram_element.sku.name;planogram_element.faces_count;planogram_element.stack_count
Z0810;3;2019-11-20 00:00:00;2019-12-20 00:00:00;T23_DG_szybkie przekaski_1.0_7; 0007;;1;84;12002255;OLIWKI ZIELONE W ZIOŁACH 90G MW;1;1
Z0810;3;2019-11-20 00:00:00;2019-12-20 00:00:00;T23_DG_szybkie przekaski_1.0_7; 0007;;1;85;12004137;OLIWKI ZIELONE CHILLI 90G MW;1;1
Z0810;3;2019-11-20 00:00:00;2019-12-20 00:00:00;T23_DG_szybkie przekaski_1.0_7; 0007;;1;86;12002214;SAŁATKA KUSKUS Z HUMMUSEM 180G MW;1;1
Z0810;3;2019-11-20 00:00:00;2019-12-20 00:00:00;T23_DG_szybkie przekaski_1.0_7; 0007;;1;87;12002257;SAŁATKA BULGUR Z HUMMUSEM 180G MW;1;1
Z0810;3;2019-11-20 00:00:00;2019-12-20 00:00:00;T23_DG_szybkie przekaski_1.0_7; 0007;;1;88;12004621;SAŁATKA PROTEINOWA QUINOA DK 180G MW;1;1
Z0810;3;2019-11-20 00:00:00;2019-12-20 00:00:00;T23_DG_szybkie przekaski_1.0_7; 0007;;1;89;12005249;SAŁATKA AL DENTE SUSZ.POM. 150G LISNER;1;1
Z0810;3;2019-11-20 00:00:00;2019-12-20 00:00:00;T23_DG_szybkie przekaski_1.0_7; 0007;;1;90;12005257;SAŁATKA AL DENTE KURCZ. BROK.150G LISNER;1;1
Z0810;3;2019-11-20 00:00:00;2019-12-20 00:00:00;T23_DG_szybkie przekaski_1.0_7; 0007;;1;91;10988803;SAŁATKA AMERYKAŃSKA TO GO 200G GRZEŚK.;1;1
Z0810;3;2019-11-20 00:00:00;2019-12-20 00:00:00;T23_DG_szybkie przekaski_1.0_7; 0007;;1;92;12000764;SAŁATKA BULGUR CIEC. POMIDOR 200G GRZE...;1;1
Z0810;3;2019-11-20 00:00:00;2019-12-20 00:00:00;T23_DG_szybkie przekaski_1.0_7; 0007;;1;93;20000243;SUSHI ŚWIEŻE 1 REG;1;1
Z0810;3;2019-11-20 00:00:00;2019-12-20 00:00:00;T23_DG_szybkie przekaski_1.0_7; 0007;;2;74;12004462;SAŁATKA SHAKER MOZZARELLA PESTO 130G ...;1;1
Z0810;3;2019-11-20 00:00:00;2019-12-20 00:00:00;T23_DG_szybkie przekaski_1.0_7; 0007;;2;75;12004478;SAŁATKA SHAKER KASZA KURCZAK DK 150G M...;1;1
Z0810;3;2019-11-20 00:00:00;2019-12-20 00:00:00;T23_DG_szybkie przekaski_1.0_7; 0007;;2;76;12004179;SNACKI WARZYWA & HUMMUS DK 230G MW;1;1
Z0810;3;2019-11-20 00:00:00;2019-12-20 00:00:00;T23_DG_szybkie przekaski_1.0_7; 0007;;2;77;12002247;HUMMUS KLASYCZNY/PAPRYKOWY MIX 110G ...;1;1
Z0810;3;2019-11-20 00:00:00;2019-12-20 00:00:00;T23_DG_szybkie przekaski_1.0_7; 0007;;2;78;12004510;HUMMUS Z FA^FELEM 220G MW;1;1
Z0810;3;2019-11-20 00:00:00;2019-12-20 00:00:00;T23_DG_szybkie przekaski_1.0_7; 0007;;2;79;12005502;ONIGIRI TUŃCZYK PREMIUM 120G;1;1
Z0810;3;2019-11-20 00:00:00;2019-12-20 00:00:00;T23_DG_szybkie przekaski_1.0_7; 0007;;2;80;12004301;ONIGIRI ŁOSOŚ PREMIUM 120G;1;1
Z0810;3;2019-11-20 00:00:00;2019-12-20 00:00:00;T23_DG_szybkie przekaski_1.0_7; 0007;;2;81;12004417;SUSHIBOX PREMIUM TOKYO TEY 245G;1;1
Z0810;3;2019-11-20 00:00:00;2019-12-20 00:00:00;T23_DG_szybkie przekaski_1.0_7; 0007;;2;82;12000348;SUSHI KATSUMI 420G;1;1
Z0810;3;2019-11-20 00:00:00;2019-12-20 00:00:00;T23_DG_szybkie przekaski_1.0_7; 0007;;2;83;12000355;SUSHI NORIKO 225G;1;1
Z0810;3;2019-11-20 00:00:00;2019-12-20 00:00:00;T23_DG_szybkie przekaski_1.0_7; 0007;;3;56;12004162;SAŁATKA LUNCHBOX ROMANTICA DK 155G MW;1;1
Z0810;3;2019-11-20 00:00:00;2019-12-20 00:00:00;T23_DG_szybkie przekaski_1.0_7; 0007;;3;57;12004189;SAŁATKA LUNCHBOX KURCZAK SER DK 195G ...;1;1
Z0810;3;2019-11-20 00:00:00;2019-12-20 00:00:00;T23_DG_szybkie przekaski_1.0_7; 0007;;3;58;12005577;SAŁATKA Z KREWETKAMI POKE BOWL 330G;1;1
Z0810;3;2019-11-20 00:00:00;2019-12-20 00:00:00;T23_DG_szybkie przekaski_1.0_7; 0007;;3;59;12004330;SAŁATKA Z ŁOSOSIEM POKE BOWL 330G;1;1
Z0810;3;2019-11-20 00:00:00;2019-12-20 00:00:00;T23_DG_szybkie przekaski_1.0_7; 0007;;3;60;80410373;PANINI KURCZAK 185G MW;1;1
Z0810;3;2019-11-20 00:00:00;2019-12-20 00:00:00;T23_DG_szybkie przekaski_1.0_7; 0007;;3;61;12004329;ZK PANINI KURCZAK CHŁODZONE 185G MW;1;1
Z0810;3;2019-11-20 00:00:00;2019-12-20 00:00:00;T23_DG_szybkie przekaski_1.0_7; 0007;;3;62;80410472;TOST Z KEBABEM Z KURCZAKA 130G MW;1;1
Z0810;3;2019-11-20 00:00:00;2019-12-20 00:00:00;T23_DG_szybkie przekaski_1.0_7; 0007;;3;63;12004244;ZK PANINI SER SZYNKA CHŁODZONE 175G MW;1;1
Z0810;3;2019-11-20 00:00:00;2019-12-20 00:00:00;T23_DG_szybkie przekaski_1.0_7; 0007;;3;64;80410471;TOST Z SZYNKĄ I SEREM 115G MW;1;1
Z0810;3;2019-11-20 00:00:00;2019-12-20 00:00:00;T23_DG_szybkie przekaski_1.0_7; 0007;;3;65;80410424;PANINI Z WARZYW GRILL 170G MW;1;1
Z0810;3;2019-11-20 00:00:00;2019-12-20 00:00:00;T23_DG_szybkie przekaski_1.0_7; 0007;;3;66;80410374;PANINI SER SZYNKA JALAPENOS 175G MW;1;1
Z0810;3;2019-11-20 00:00:00;2019-12-20 00:00:00;T23_DG_szybkie przekaski_1.0_7; 0007;;3;67;12004668;ZK PANINI Z WARZYW GRILL CHŁOD 170G MW;1;1
Z0810;3;2019-11-20 00:00:00;2019-12-20 00:00:00;T23_DG_szybkie przekaski_1.0_7; 0007;;3;68;12005255;ZK PIZZINA SZYNKA 170G MW;1;1
Z0810;3;2019-11-20 00:00:00;2019-12-20 00:00:00;T23_DG_szybkie przekaski_1.0_7; 0007;;3;69;80410462;PIZZINA SZYNKA 170G MW;1;1
Z0810;3;2019-11-20 00:00:00;2019-12-20 00:00:00;T23_DG_szybkie przekaski_1.0_7; 0007;;3;70;12005246;ZK PIZZINA SALAMI 170G MW;1;1
Z0810;3;2019-11-20 00:00:00;2019-12-20 00:00:00;T23_DG_szybkie przekaski_1.0_7; 0007;;3;71;12005213;ZK TOST Z SZYNKĄ I SEREM 115G MW;1;1
Z0810;3;2019-11-20 00:00:00;2019-12-20 00:00:00;T23_DG_szybkie przekaski_1.0_7; 0007;;3;72;12005184;ZK TOST Z KEBABEM Z KURCZAKA 130G MW;1;1
Z0810;3;2019-11-20 00:00:00;2019-12-20 00:00:00;T23_DG_szybkie przekaski_1.0_7; 0007;;3;73;80410463;PIZZINA SALAMI 170G MW;1;1
Z0810;3;2019-11-20 00:00:00;2019-12-20 00:00:00;T23_DG_szybkie przekaski_1.0_7; 0007;;4;46;12004638;KAJZERKA KEBAB 137G MW;1;1
Z0810;3;2019-11-20 00:00:00;2019-12-20 00:00:00;T23_DG_szybkie przekaski_1.0_7; 0007;;4;47;12000229;KAJZERKA Z SZYNKĄ TOMCIO PALUCH 116G MW;1;1
Z0810;3;2019-11-20 00:00:00;2019-12-20 00:00:00;T23_DG_szybkie przekaski_1.0_7; 0007;;4;48;12000230;KAJZERKA Z JAJKIEM TOMCIO PALUCH 120G M...;1;1
Z0810;3;2019-11-20 00:00:00;2019-12-20 00:00:00;T23_DG_szybkie przekaski_1.0_7; 0007;;4;49;12000275;KAJZERKA Z SEREM TOMCIO PALUCH 122G MW;1;1
Z0810;3;2019-11-20 00:00:00;2019-12-20 00:00:00;T23_DG_szybkie przekaski_1.0_7; 0007;;4;50;12004651;MINI BAGIETKA SZYNKA JAJKO 181G MW;2;1
Z0810;3;2019-11-20 00:00:00;2019-12-20 00:00:00;T23_DG_szybkie przekaski_1.0_7; 0007;;4;51;10990872;BAGIETKA HOT STR TOMCIO PALUCH 240G MW;2;1
Z0810;3;2019-11-20 00:00:00;2019-12-20 00:00:00;T23_DG_szybkie przekaski_1.0_7; 0007;;4;52;10990873;BAGIETKA ANDALUZ. TOMCIO PALUCH 210G MW;1;1
Z0810;3;2019-11-20 00:00:00;2019-12-20 00:00:00;T23_DG_szybkie przekaski_1.0_7; 0007;;4;53;12003682;BAGIETKA ŚRÓDZIEMNOMOR 250G TOM PA MW;1;1
Z0810;3;2019-11-20 00:00:00;2019-12-20 00:00:00;T23_DG_szybkie przekaski_1.0_7; 0007;;4;54;12003692;BAGIETKA KATALOŃSKA 225G TOM PAL MW;1;1
Z0810;3;2019-11-20 00:00:00;2019-12-20 00:00:00;T23_DG_szybkie przekaski_1.0_7; 0007;;4;55;12005275;BAGIETKA JAJKO SZYNKA FOODMAKERS 225G;1;1
Z0810;3;2019-11-20 00:00:00;2019-12-20 00:00:00;T23_DG_szybkie przekaski_1.0_7; 0007;;5;35;12000254;KANAPKA TRÓJ CEZAR TOMCIO PALUCH 205G ...;2;1
Z0810;3;2019-11-20 00:00:00;2019-12-20 00:00:00;T23_DG_szybkie przekaski_1.0_7; 0007;;5;36;12004331;KANAPKA TRÓJ.TOSKANSKA TOM.PAL 190G MW;1;1
Z0810;3;2019-11-20 00:00:00;2019-12-20 00:00:00;T23_DG_szybkie przekaski_1.0_7; 0007;;5;37;10990874;KANAPKA TRÓJ JAJKO BEKON TOMCIO 220G ...;1;1
Z0810;3;2019-11-20 00:00:00;2019-12-20 00:00:00;T23_DG_szybkie przekaski_1.0_7; 0007;;5;38;12000253;KANAPKA TRÓJ SZYN TOMCIO PALUCH 210G ...;1;1
Z0810;3;2019-11-20 00:00:00;2019-12-20 00:00:00;T23_DG_szybkie przekaski_1.0_7; 0007;;5;39;12004300;KANAPKA TRÓJ. Z ŁOSOSIEM TOM.PAL 190G M...;1;1
Z0810;3;2019-11-20 00:00:00;2019-12-20 00:00:00;T23_DG_szybkie przekaski_1.0_7; 0007;;5;40;12005234;KANAPKA TRÓJ KURC.Z WARZ.FOODMAKERS ...;1;1
Z0810;3;2019-11-20 00:00:00;2019-12-20 00:00:00;T23_DG_szybkie przekaski_1.0_7; 0007;;5;41;12005233;KANAPKA TRÓJ TUŃCZ.JAJKO FOODMAKERS ...;1;1
Z0810;3;2019-11-20 00:00:00;2019-12-20 00:00:00;T23_DG_szybkie przekaski_1.0_7; 0007;;5;42;20000235;KANAPKA REGIONALNA 1 REG;1;1
Z0810;3;2019-11-20 00:00:00;2019-12-20 00:00:00;T23_DG_szybkie przekaski_1.0_7; 0007;;5;43;20000236;KANAPKA REGIONALNA 2 REG;1;1
Z0810;3;2019-11-20 00:00:00;2019-12-20 00:00:00;T23_DG_szybkie przekaski_1.0_7; 0007;;5;44;20000231;SOKI W BUTELCE 7 DNIOWE MIX 1 REG;1;1
Z0810;3;2019-11-20 00:00:00;2019-12-20 00:00:00;T23_DG_szybkie przekaski_1.0_7; 0007;;5;45;20000235;KANAPKA REGIONALNA 1 REG;1;1
Z0810;3;2019-11-20 00:00:00;2019-12-20 00:00:00;T23_DG_szybkie przekaski_1.0_7; 0007;;6;18;12004347;LEMONIADA WYCISK CYTRYNOWA 400ML MW;1;1
Z0810;3;2019-11-20 00:00:00;2019-12-20 00:00:00;T23_DG_szybkie przekaski_1.0_7; 0007;;6;19;12004481;LEMONIADA WYCISK GREJPF. TRUSK, 400ML ...;1;1
Z0810;3;2019-11-20 00:00:00;2019-12-20 00:00:00;T23_DG_szybkie przekaski_1.0_7; 0007;;6;20;12004365;SOK WYCISK POMARAŃCZOWY 250ML MW;2;1
Z0810;3;2019-11-20 00:00:00;2019-12-20 00:00:00;T23_DG_szybkie przekaski_1.0_7; 0007;;6;21;12004487;SOK WYCISK POMARAŃCZA,GREJPFRUT 250M...;1;1
Z0810;3;2019-11-20 00:00:00;2019-12-20 00:00:00;T23_DG_szybkie przekaski_1.0_7; 0007;;6;22;12004366;SOK WYCISK GRAPEFRUIT 250ML MW;1;1
Z0810;3;2019-11-20 00:00:00;2019-12-20 00:00:00;T23_DG_szybkie przekaski_1.0_7; 0007;;6;23;12004463;SOK WYCISK AWOCADO SZPINAK 250ML MW;1;1
Z0810;3;2019-11-20 00:00:00;2019-12-20 00:00:00;T23_DG_szybkie przekaski_1.0_7; 0007;;6;24;12004332;SOK WYCISK POMAR/MARAKUJA/MACA 250ML ...;1;1
Z0810;3;2019-11-20 00:00:00;2019-12-20 00:00:00;T23_DG_szybkie przekaski_1.0_7; 0007;;6;25;12004452;SOK WYCISK TRUSKAWKA MALIN ACAI 250ML ...;1;1
Z0810;3;2019-11-20 00:00:00;2019-12-20 00:00:00;T23_DG_szybkie przekaski_1.0_7; 0007;;6;26;12004284;SOK WYCISK MARCH/ANANAS/KURKUMA 250M...;1;1
Z0810;3;2019-11-20 00:00:00;2019-12-20 00:00:00;T23_DG_szybkie przekaski_1.0_7; 0007;;6;27;12004451;SOK WYCISK JABŁKO CYTRYNA MIĘTA 250ML ...;1;1
Z0810;3;2019-11-20 00:00:00;2019-12-20 00:00:00;T23_DG_szybkie przekaski_1.0_7; 0007;;6;28;12004482;SOK WYCISK MARCHEW, JABŁKO 250ML MW;1;1
Z0810;3;2019-11-20 00:00:00;2019-12-20 00:00:00;T23_DG_szybkie przekaski_1.0_7; 0007;;6;29;12004497;SOK WYCISK BURAK MALINA 250ML MW;1;1
Z0810;3;2019-11-20 00:00:00;2019-12-20 00:00:00;T23_DG_szybkie przekaski_1.0_7; 0007;;6;30;12005456;KULKI RYŻOWE MALINA PORZECZKA 125G MW;1;1
Z0810;3;2019-11-20 00:00:00;2019-12-20 00:00:00;T23_DG_szybkie przekaski_1.0_7; 0007;;6;31;12004044;KULKI RYŻOWE Z MANGO I MARKUJĄ 125G MW;1;1
Z0810;3;2019-11-20 00:00:00;2019-12-20 00:00:00;T23_DG_szybkie przekaski_1.0_7; 0007;;6;32;12002734;DESER CHIA Z MANGO 140G MW;1;2
Z0810;3;2019-11-20 00:00:00;2019-12-20 00:00:00;T23_DG_szybkie przekaski_1.0_7; 0007;;6;33;12004534;OWSIANKA KOKOS WIŚNIA 210G DOPPELT;1;1
Z0810;3;2019-11-20 00:00:00;2019-12-20 00:00:00;T23_DG_szybkie przekaski_1.0_7; 0007;;6;34;12004615;OWSIANKA KOKOS MANGO MARAKU 210G DO...;1;1
Z0810;3;2019-11-20 00:00:00;2019-12-20 00:00:00;T23_DG_szybkie przekaski_1.0_7; 0007;;7;1;12001071;KAWA COLD BREW CLASSIC 220ML;1;1
Z0810;3;2019-11-20 00:00:00;2019-12-20 00:00:00;T23_DG_szybkie przekaski_1.0_7; 0007;;7;2;10900593;WODA NAŁĘCZOWIANKA 0,5L NGAZ PET;1;1
Z0810;3;2019-11-20 00:00:00;2019-12-20 00:00:00;T23_DG_szybkie przekaski_1.0_7; 0007;;7;3;12003717;SMOOTHIE FOODINI JOGURT ŻÓŁTY 250ML MW;1;1
Z0810;3;2019-11-20 00:00:00;2019-12-20 00:00:00;T23_DG_szybkie przekaski_1.0_7; 0007;;7;4;12003699;SMOOTHIE FOODINI JOGURT RÓŻOWY 250ML ...;1;1
Z0810;3;2019-11-20 00:00:00;2019-12-20 00:00:00;T23_DG_szybkie przekaski_1.0_7; 0007;;7;5;12003664;SMOOTHIE FOODINI BEZTR.CZERWONY 250M...;1;1
Z0810;3;2019-11-20 00:00:00;2019-12-20 00:00:00;T23_DG_szybkie przekaski_1.0_7; 0007;;7;6;12003662;SMOOTHIE FOODINI RAJSKO KREMOWY 250M...;1;1
Z0810;3;2019-11-20 00:00:00;2019-12-20 00:00:00;T23_DG_szybkie przekaski_1.0_7; 0007;;7;7;12003706;SMOOTHIE FOODINI SMACZ. ZIELONY 250ML ...;1;1
Z0810;3;2019-11-20 00:00:00;2019-12-20 00:00:00;T23_DG_szybkie przekaski_1.0_7; 0007;;7;8;12003716;SMOOTHIE FOODINI SŁONECZ. ŻÓŁTY 250ML ...;1;1
Z0810;3;2019-11-20 00:00:00;2019-12-20 00:00:00;T23_DG_szybkie przekaski_1.0_7; 0007;;7;9;12003663;SMOOTHIE FOODINI EGZOTYCZ.ŻÓŁTY 250ML...;1;1
Z0810;3;2019-11-20 00:00:00;2019-12-20 00:00:00;T23_DG_szybkie przekaski_1.0_7; 0007;;7;10;12003715;SMOOTHIE FOODINI KOJĄCO ZIELONY 250ML ...;1;1
Z0810;3;2019-11-20 00:00:00;2019-12-20 00:00:00;T23_DG_szybkie przekaski_1.0_7; 0007;;7;11;12001574;SOK MARCHWIOWY Z MIODEM 330ML DELICADE;1;1
Z0810;3;2019-11-20 00:00:00;2019-12-20 00:00:00;T23_DG_szybkie przekaski_1.0_7; 0007;;7;12;20000231;SOKI W BUTELCE 7 DNIOWE MIX 1 REG;1;1
Z0810;3;2019-11-20 00:00:00;2019-12-20 00:00:00;T23_DG_szybkie przekaski_1.0_7; 0007;;7;13;20000232;SOKI W BUTELCE 7 DNIOWE MIX 2 REG;1;1
Z0810;3;2019-11-20 00:00:00;2019-12-20 00:00:00;T23_DG_szybkie przekaski_1.0_7; 0007;;7;14;12005162;MUS JABŁKO-MANGO ZIARN GOOD MOOD 130...;1;1
Z0810;3;2019-11-20 00:00:00;2019-12-20 00:00:00;T23_DG_szybkie przekaski_1.0_7; 0007;;7;15;12005185;MUS JABŁKOWY GOOD MOOD 130G MW;1;1
Z0810;3;2019-11-20 00:00:00;2019-12-20 00:00:00;T23_DG_szybkie przekaski_1.0_7; 0007;;7;16;12005286;OWOCE MIX KAWAŁKI KUBEK 200G;1;1
Z0810;3;2019-11-20 00:00:00;2019-12-20 00:00:00;T23_DG_szybkie przekaski_1.0_7; 0007;;7;17;12005260;ANANAS KAWAŁKI KUBEK 200G;1;1
;;;;;;;;;;;;
Z2680, Z2520, Z8788, Z2957, Z6730, Z6688, Z8008, Z6436, Z6742, Z7510, Z5928, Z8508;2;2019-11-20 00:00:00;2019-12-20 00:00:00;O_DG_dania gotowe_1.0_6; 0007;;1;35;10929954;BAGIETKA Z MASŁEM I CZOSNKIEM 175G;1;1
Z2680, Z2520, Z8788, Z2957, Z6730, Z6688, Z8008, Z6436, Z6742, Z7510, Z5928, Z8508;2;2019-11-20 00:00:00;2019-12-20 00:00:00;O_DG_dania gotowe_1.0_6; 0007;;1;36;10931554;TORTILLA LATYNOSKA 250G KONSPOL;1;1
Z2680, Z2520, Z8788, Z2957, Z6730, Z6688, Z8008, Z6436, Z6742, Z7510, Z5928, Z8508;2;2019-11-20 00:00:00;2019-12-20 00:00:00;O_DG_dania gotowe_1.0_6; 0007;;1;37;10931553;TORTILLA ARABSKA 250G KONSPOL;1;1
Z2680, Z2520, Z8788, Z2957, Z6730, Z6688, Z8008, Z6436, Z6742, Z7510, Z5928, Z8508;2;2019-11-20 00:00:00;2019-12-20 00:00:00;O_DG_dania gotowe_1.0_6; 0007;;1;38;10931545;ZAPIEKANKA Z SZYNKĄ VIRTU 235G;1;1
Z2680, Z2520, Z8788, Z2957, Z6730, Z6688, Z8008, Z6436, Z6742, Z7510, Z5928, Z8508;2;2019-11-20 00:00:00;2019-12-20 00:00:00;O_DG_dania gotowe_1.0_6; 0007;;1;39;10931546;ZAPIEKANKA Z PIECZARKAMI VIRTU 235G;1;1
Z2680, Z2520, Z8788, Z2957, Z6730, Z6688, Z8008, Z6436, Z6742, Z7510, Z5928, Z8508;2;2019-11-20 00:00:00;2019-12-20 00:00:00;O_DG_dania gotowe_1.0_6; 0007;;1;40;10985242;KROKIETY Z KAPUSTĄ I GRZYB 400G;1;1
Z2680, Z2520, Z8788, Z2957, Z6730, Z6688, Z8008, Z6436, Z6742, Z7510, Z5928, Z8508;2;2019-11-20 00:00:00;2019-12-20 00:00:00;O_DG_dania gotowe_1.0_6; 0007;;1;41;10985243;KROKIETY Z MIĘSEM 400G U JĘDRUSIA;1;1
Z2680, Z2520, Z8788, Z2957, Z6730, Z6688, Z8008, Z6436, Z6742, Z7510, Z5928, Z8508;2;2019-11-20 00:00:00;2019-12-20 00:00:00;O_DG_dania gotowe_1.0_6; 0007;;1;42;10985876;PIEROGI Z MIĘSEM 400G U JĘDRUSIA;1;1
Z2680, Z2520, Z8788, Z2957, Z6730, Z6688, Z8008, Z6436, Z6742, Z7510, Z5928, Z8508;2;2019-11-20 00:00:00;2019-12-20 00:00:00;O_DG_dania gotowe_1.0_6; 0007;;1;43;10985877;PIEROGI RUSKIE 400G U JĘDRUSIA;1;1
Z2680, Z2520, Z8788, Z2957, Z6730, Z6688, Z8008, Z6436, Z6742, Z7510, Z5928, Z8508;2;2019-11-20 00:00:00;2019-12-20 00:00:00;O_DG_dania gotowe_1.0_6; 0007;;1;44;12003574;POLĘDWICZKI PANIEROWANE 200G + SOS MW;1;2
Z2680, Z2520, Z8788, Z2957, Z6730, Z6688, Z8008, Z6436, Z6742, Z7510, Z5928, Z8508;2;2019-11-20 00:00:00;2019-12-20 00:00:00;O_DG_dania gotowe_1.0_6; 0007;;1;45;12003581;SKRZYDEŁKA PANIEROWANE 250G + SOS MW;1;2
Z2680, Z2520, Z8788, Z2957, Z6730, Z6688, Z8008, Z6436, Z6742, Z7510, Z5928, Z8508;2;2019-11-20 00:00:00;2019-12-20 00:00:00;O_DG_dania gotowe_1.0_6; 0007;;1;46;12002262;KOTLET CORDON BLEU 250G MW;1;2
Z2680, Z2520, Z8788, Z2957, Z6730, Z6688, Z8008, Z6436, Z6742, Z7510, Z5928, Z8508;2;2019-11-20 00:00:00;2019-12-20 00:00:00;O_DG_dania gotowe_1.0_6; 0007;;2;29;12005005;ROLADA WOŁOWA 400G MW;1;2
Z2680, Z2520, Z8788, Z2957, Z6730, Z6688, Z8008, Z6436, Z6742, Z7510, Z5928, Z8508;2;2019-11-20 00:00:00;2019-12-20 00:00:00;O_DG_dania gotowe_1.0_6; 0007;;2;30;12004987;PIECZONY SCHAB W SOSIE 400G MW;1;2
Z2680, Z2520, Z8788, Z2957, Z6730, Z6688, Z8008, Z6436, Z6742, Z7510, Z5928, Z8508;2;2019-11-20 00:00:00;2019-12-20 00:00:00;O_DG_dania gotowe_1.0_6; 0007;;2;31;12003572;KOTLET MIELONY WIEPRZ BURACZKI 400G MW;1;1
Z2680, Z2520, Z8788, Z2957, Z6730, Z6688, Z8008, Z6436, Z6742, Z7510, Z5928, Z8508;2;2019-11-20 00:00:00;2019-12-20 00:00:00;O_DG_dania gotowe_1.0_6; 0007;;2;32;12003601;KOTLET DROBIOWY Z MARCHEWKĄ 400G MW;1;1
Z2680, Z2520, Z8788, Z2957, Z6730, Z6688, Z8008, Z6436, Z6742, Z7510, Z5928, Z8508;2;2019-11-20 00:00:00;2019-12-20 00:00:00;O_DG_dania gotowe_1.0_6; 0007;;2;33;12004471;PLACKI ZIEMNIACZANE Z GULASZEM 350G MW;1;2
Z2680, Z2520, Z8788, Z2957, Z6730, Z6688, Z8008, Z6436, Z6742, Z7510, Z5928, Z8508;2;2019-11-20 00:00:00;2019-12-20 00:00:00;O_DG_dania gotowe_1.0_6; 0007;;2;34;12004968;MAKARON PENNE PEPPERONI 400G MW;1;2
Z2680, Z2520, Z8788, Z2957, Z6730, Z6688, Z8008, Z6436, Z6742, Z7510, Z5928, Z8508;2;2019-11-20 00:00:00;2019-12-20 00:00:00;O_DG_dania gotowe_1.0_6; 0007;;3;23;12004979;KACZKA Z WARZYWAMI I MAKARONEM 400G M...;1;2
Z2680, Z2520, Z8788, Z2957, Z6730, Z6688, Z8008, Z6436, Z6742, Z7510, Z5928, Z8508;2;2019-11-20 00:00:00;2019-12-20 00:00:00;O_DG_dania gotowe_1.0_6; 0007;;3;24;12004988;KURCZAK Z SOSEM CURRY I RYŻEM 430G MW;1;2
Z2680, Z2520, Z8788, Z2957, Z6730, Z6688, Z8008, Z6436, Z6742, Z7510, Z5928, Z8508;2;2019-11-20 00:00:00;2019-12-20 00:00:00;O_DG_dania gotowe_1.0_6; 0007;;3;25;12004980;KURCZAK W SOSIE SŁODKO-KWAŚNYM 400G ...;1;2
Z2680, Z2520, Z8788, Z2957, Z6730, Z6688, Z8008, Z6436, Z6742, Z7510, Z5928, Z8508;2;2019-11-20 00:00:00;2019-12-20 00:00:00;O_DG_dania gotowe_1.0_6; 0007;;3;26;12004708;KURCZAK GONG BAO 400G MW;1;2
Z2680, Z2520, Z8788, Z2957, Z6730, Z6688, Z8008, Z6436, Z6742, Z7510, Z5928, Z8508;2;2019-11-20 00:00:00;2019-12-20 00:00:00;O_DG_dania gotowe_1.0_6; 0007;;3;27;12004954;SPAGHETTI BOLOGNESE 400G MW;1;2
Z2680, Z2520, Z8788, Z2957, Z6730, Z6688, Z8008, Z6436, Z6742, Z7510, Z5928, Z8508;2;2019-11-20 00:00:00;2019-12-20 00:00:00;O_DG_dania gotowe_1.0_6; 0007;;3;28;12005007;SPAGHETTI CARBONARA 400G MW;1;2
Z2680, Z2520, Z8788, Z2957, Z6730, Z6688, Z8008, Z6436, Z6742, Z7510, Z5928, Z8508;2;2019-11-20 00:00:00;2019-12-20 00:00:00;O_DG_dania gotowe_1.0_6; 0007;;4;16;10985950;KURCZAK TIKKA MASALA Z RYŻEM 450G;1;1
Z2680, Z2520, Z8788, Z2957, Z6730, Z6688, Z8008, Z6436, Z6742, Z7510, Z5928, Z8508;2;2019-11-20 00:00:00;2019-12-20 00:00:00;O_DG_dania gotowe_1.0_6; 0007;;4;17;10985949;KURCZAK INDYJSKI JALFREZI Z RYŻEM 450G;1;1
Z2680, Z2520, Z8788, Z2957, Z6730, Z6688, Z8008, Z6436, Z6742, Z7510, Z5928, Z8508;2;2019-11-20 00:00:00;2019-12-20 00:00:00;O_DG_dania gotowe_1.0_6; 0007;;4;18;12004496;DANIE MASSAMAN CURRY Z RYŻ. JAŚ.350G MW;1;1
Z2680, Z2520, Z8788, Z2957, Z6730, Z6688, Z8008, Z6436, Z6742, Z7510, Z5928, Z8508;2;2019-11-20 00:00:00;2019-12-20 00:00:00;O_DG_dania gotowe_1.0_6; 0007;;4;19;12004480;DANIE KURCZ RED CURRY Z RYŻ.JAŚ. 350G MW;1;1
Z2680, Z2520, Z8788, Z2957, Z6730, Z6688, Z8008, Z6436, Z6742, Z7510, Z5928, Z8508;2;2019-11-20 00:00:00;2019-12-20 00:00:00;O_DG_dania gotowe_1.0_6; 0007;;4;20;12004221;KURCZAK WARZYWA Z CIECIERZYCĄ 300G MW;1;2
Z2680, Z2520, Z8788, Z2957, Z6730, Z6688, Z8008, Z6436, Z6742, Z7510, Z5928, Z8508;2;2019-11-20 00:00:00;2019-12-20 00:00:00;O_DG_dania gotowe_1.0_6; 0007;;4;21;12004612;MAKARON Z SOSEM POMIDOROWYM 300G MW;1;2
Z2680, Z2520, Z8788, Z2957, Z6730, Z6688, Z8008, Z6436, Z6742, Z7510, Z5928, Z8508;2;2019-11-20 00:00:00;2019-12-20 00:00:00;O_DG_dania gotowe_1.0_6; 0007;;4;22;12005461;ROŚLINNY BURGER 170G;1;2
Z2680, Z2520, Z8788, Z2957, Z6730, Z6688, Z8008, Z6436, Z6742, Z7510, Z5928, Z8508;2;2019-11-20 00:00:00;2019-12-20 00:00:00;O_DG_dania gotowe_1.0_6; 0007;;5;10;12004562;PIEROGI Z MASCARPONE I SOS JAGOD 300G M...;1;2
Z2680, Z2520, Z8788, Z2957, Z6730, Z6688, Z8008, Z6436, Z6742, Z7510, Z5928, Z8508;2;2019-11-20 00:00:00;2019-12-20 00:00:00;O_DG_dania gotowe_1.0_6; 0007;;5;11;12003987;RACUCHY Z JABŁKAMI 300G MW;1;2
Z2680, Z2520, Z8788, Z2957, Z6730, Z6688, Z8008, Z6436, Z6742, Z7510, Z5928, Z8508;2;2019-11-20 00:00:00;2019-12-20 00:00:00;O_DG_dania gotowe_1.0_6; 0007;;5;12;12002243;PLACKI ZIEMNIACZANE 400G MW;1;2
Z2680, Z2520, Z8788, Z2957, Z6730, Z6688, Z8008, Z6436, Z6742, Z7510, Z5928, Z8508;2;2019-11-20 00:00:00;2019-12-20 00:00:00;O_DG_dania gotowe_1.0_6; 0007;;5;13;12002232;NALEŚNIKI Z SEREM 300G MW;1;2
Z2680, Z2520, Z8788, Z2957, Z6730, Z6688, Z8008, Z6436, Z6742, Z7510, Z5928, Z8508;2;2019-11-20 00:00:00;2019-12-20 00:00:00;O_DG_dania gotowe_1.0_6; 0007;;5;14;12004669;NALEŚNIKI Z SEREM I CZEKOLADĄ 200G MW;1;2
Z2680, Z2520, Z8788, Z2957, Z6730, Z6688, Z8008, Z6436, Z6742, Z7510, Z5928, Z8508;2;2019-11-20 00:00:00;2019-12-20 00:00:00;O_DG_dania gotowe_1.0_6; 0007;;5;15;12004241;NALEŚNIKI ARRABIATA Z KURCZAKIEM 200G MW;1;2
Z2680, Z2520, Z8788, Z2957, Z6730, Z6688, Z8008, Z6436, Z6742, Z7510, Z5928, Z8508;2;2019-11-20 00:00:00;2019-12-20 00:00:00;O_DG_dania gotowe_1.0_6; 0007;;6;1;12004982;ZUPA TAJSKA Z KURCZAKIEM 380G MW;1;1
Z2680, Z2520, Z8788, Z2957, Z6730, Z6688, Z8008, Z6436, Z6742, Z7510, Z5928, Z8508;2;2019-11-20 00:00:00;2019-12-20 00:00:00;O_DG_dania gotowe_1.0_6; 0007;;6;2;12005006;ZUPA MAROKAŃSKA 380G MW;1;1
Z2680, Z2520, Z8788, Z2957, Z6730, Z6688, Z8008, Z6436, Z6742, Z7510, Z5928, Z8508;2;2019-11-20 00:00:00;2019-12-20 00:00:00;O_DG_dania gotowe_1.0_6; 0007;;6;3;12004981;ZUPA KREM Z BIAŁYCH WARZYW 390G MW;1;1
Z2680, Z2520, Z8788, Z2957, Z6730, Z6688, Z8008, Z6436, Z6742, Z7510, Z5928, Z8508;2;2019-11-20 00:00:00;2019-12-20 00:00:00;O_DG_dania gotowe_1.0_6; 0007;;6;4;12003593;ZUPA KREM Z POMIDORA 350G MW;1;1
Z2680, Z2520, Z8788, Z2957, Z6730, Z6688, Z8008, Z6436, Z6742, Z7510, Z5928, Z8508;2;2019-11-20 00:00:00;2019-12-20 00:00:00;O_DG_dania gotowe_1.0_6; 0007;;6;5;12003614;ZUPA OGÓRKOWA 350G MW;1;1
Z2680, Z2520, Z8788, Z2957, Z6730, Z6688, Z8008, Z6436, Z6742, Z7510, Z5928, Z8508;2;2019-11-20 00:00:00;2019-12-20 00:00:00;O_DG_dania gotowe_1.0_6; 0007;;6;6;12004574;PIEROGI DROBIOWE Z SMAŻ CEBUL 320G MW;1;2
Z2680, Z2520, Z8788, Z2957, Z6730, Z6688, Z8008, Z6436, Z6742, Z7510, Z5928, Z8508;2;2019-11-20 00:00:00;2019-12-20 00:00:00;O_DG_dania gotowe_1.0_6; 0007;;6;7;12002252;PIEROGI Z MIĘSEM W KUBKU 320G MW;1;1
Z2680, Z2520, Z8788, Z2957, Z6730, Z6688, Z8008, Z6436, Z6742, Z7510, Z5928, Z8508;2;2019-11-20 00:00:00;2019-12-20 00:00:00;O_DG_dania gotowe_1.0_6; 0007;;6;8;12002242;PIEROGI RUSKIE W KUBKU 320G MW;1;1
Z2680, Z2520, Z8788, Z2957, Z6730, Z6688, Z8008, Z6436, Z6742, Z7510, Z5928, Z8508;2;2019-11-20 00:00:00;2019-12-20 00:00:00;O_DG_dania gotowe_1.0_6; 0007;;6;9;20000008;PRODUKT MĄCZNY 1 REG;1;1
;;;;;;;;;;;;
Z1790;2;2019-11-20 00:00:00;2019-12-20 00:00:00;O_DG_dania gotowe_0.9_6;0019;;1;33;10990580;KANAPKI CHICKEN DUO 2 SZT 270G;1;1
Z1790;2;2019-11-20 00:00:00;2019-12-20 00:00:00;O_DG_dania gotowe_0.9_6;0019;;1;34;10931554;TORTILLA LATYNOSKA 250G KONSPOL;1;1
Z1790;2;2019-11-20 00:00:00;2019-12-20 00:00:00;O_DG_dania gotowe_0.9_6;0019;;1;35;10931553;TORTILLA ARABSKA 250G KONSPOL;1;1
Z1790;2;2019-11-20 00:00:00;2019-12-20 00:00:00;O_DG_dania gotowe_0.9_6;0019;;1;36;12003574;POLĘDWICZKI PANIEROWANE 200G + SOS MW;1;2
Z1790;2;2019-11-20 00:00:00;2019-12-20 00:00:00;O_DG_dania gotowe_0.9_6;0019;;1;37;12003581;SKRZYDEŁKA PANIEROWANE 250G + SOS MW;1;2
Z1790;2;2019-11-20 00:00:00;2019-12-20 00:00:00;O_DG_dania gotowe_0.9_6;0019;;1;38;12002262;KOTLET CORDON BLEU 250G MW;1;2
Z1790;2;2019-11-20 00:00:00;2019-12-20 00:00:00;O_DG_dania gotowe_0.9_6;0019;;1;39;10985242;KROKIETY Z KAPUSTĄ I GRZYB 400G;1;1
Z1790;2;2019-11-20 00:00:00;2019-12-20 00:00:00;O_DG_dania gotowe_0.9_6;0019;;1;40;10985243;KROKIETY Z MIĘSEM 400G U JĘDRUSIA;1;1
Z1790;2;2019-11-20 00:00:00;2019-12-20 00:00:00;O_DG_dania gotowe_0.9_6;0019;;1;41;10985876;PIEROGI Z MIĘSEM 400G U JĘDRUSIA;1;1
Z1790;2;2019-11-20 00:00:00;2019-12-20 00:00:00;O_DG_dania gotowe_0.9_6;0019;;1;42;10985877;PIEROGI RUSKIE 400G U JĘDRUSIA;1;1
Z1790;2;2019-11-20 00:00:00;2019-12-20 00:00:00;O_DG_dania gotowe_0.9_6;0019;;2;28;12005005;ROLADA WOŁOWA 400G MW;1;2
Z1790;2;2019-11-20 00:00:00;2019-12-20 00:00:00;O_DG_dania gotowe_0.9_6;0019;;2;29;12004987;PIECZONY SCHAB W SOSIE 400G MW;1;2
Z1790;2;2019-11-20 00:00:00;2019-12-20 00:00:00;O_DG_dania gotowe_0.9_6;0019;;2;30;12004968;MAKARON PENNE PEPPERONI 400G MW;1;2
Z1790;2;2019-11-20 00:00:00;2019-12-20 00:00:00;O_DG_dania gotowe_0.9_6;0019;;2;31;12004954;SPAGHETTI BOLOGNESE 400G MW;1;2
Z1790;2;2019-11-20 00:00:00;2019-12-20 00:00:00;O_DG_dania gotowe_0.9_6;0019;;2;32;12005007;SPAGHETTI CARBONARA 400G MW;1;2
Z1790;2;2019-11-20 00:00:00;2019-12-20 00:00:00;O_DG_dania gotowe_0.9_6;0019;;3;22;12004979;KACZKA Z WARZYWAMI I MAKARONEM 400G M...;1;2
Z1790;2;2019-11-20 00:00:00;2019-12-20 00:00:00;O_DG_dania gotowe_0.9_6;0019;;3;23;12004988;KURCZAK Z SOSEM CURRY I RYŻEM 430G MW;1;2
Z1790;2;2019-11-20 00:00:00;2019-12-20 00:00:00;O_DG_dania gotowe_0.9_6;0019;;3;24;12004980;KURCZAK W SOSIE SŁODKO-KWAŚNYM 400G ...;1;2
Z1790;2;2019-11-20 00:00:00;2019-12-20 00:00:00;O_DG_dania gotowe_0.9_6;0019;;3;25;12004708;KURCZAK GONG BAO 400G MW;1;2
Z1790;2;2019-11-20 00:00:00;2019-12-20 00:00:00;O_DG_dania gotowe_0.9_6;0019;;3;26;10985950;KURCZAK TIKKA MASALA Z RYŻEM 450G;1;1
